rownum,id,author,author-aux,author-orcid,booktitle,cdate,cdrom,cite,cite-label,crossref,editor,editor-orcid,ee,ee-type,i,journal,key,mdate,month,note,note-label,note-type,number,pages,publisher,publnr,publtype,sub,sup,title,title-bibtex,tt,url,volume,year,reviewers,editors,journal_keywords,paper_keywords,decison_reviewer_0,review_reviewer_0,decison_reviewer_1,review_reviewer_1,paper_type
544,546,Clemens Lautemann|Heribert Vollmer|Klaus W. Wagner|Thomas Schwentick|Ulrich Hertrampf,,,,,,,,,,,,,,"Universität Trier, Mathematik/Informatik, Forschungsbericht",tr/trier/MI92-28,2017-06-08,,,,,,,,,informal,,,On the Power of Polynomial Bit-Reductions,,,,92-28,1992,Catherine Woteki|Paola Palmitesta,Irving L. Traiger|Somsri Wiwanitkit|Sara Goering,Cloud computing|Machine learning|Data mining|Algorithm analysis,Robotics|Machine learning|Big data,reject,Sed aliquam dolore numquam.,reject,Quiquia porro non est eius aliquam sit.,Short Paper
545,547,B. S. Tam|Peter Gritzmann|Victor Klee,,,,,,,,,,,,,,"Universität Trier, Mathematik/Informatik, Forschungsbericht",tr/trier/MI93-17,2017-06-08,,,,,,,,,informal,,,Cross-Positive Matrices Revisited,,,,93-17,1993,Qian Wang|Mladen Petrovecki,Irving L. Traiger|Somsri Wiwanitkit|Sara Goering,Cloud computing|Machine learning|Data mining|Algorithm analysis,Robotics|Natural language processing,reject,Tempora non quiquia etincidunt sed velit sit dolorem.,reject,Dolor labore etincidunt etincidunt etincidunt sed est.,Demo Paper
546,548,Dieter Baum,,,,,,,,,,,,,,"Universität Trier, Mathematik/Informatik, Forschungsbericht",tr/trier/MI02-18,2017-06-08,,,,,,,,,informal,,,Vom M/G/1- zum BMAP/G/1-Modell,,,,02-18,2002,Adrian Müller|D. Parthasarathy,Irving L. Traiger|Somsri Wiwanitkit|Sara Goering,Cloud computing|Machine learning|Data mining|Algorithm analysis,Computational complexity,reject,Etincidunt neque numquam magnam ut amet quisquam.,accept,Magnam quiquia adipisci tempora non.,Short Paper
547,549,Markus Müller-Olm,,,,,,,,,,,,,,"Universität Trier, Mathematik/Informatik, Forschungsbericht",tr/trier/MI02-08,2017-06-08,,,,,,,,,informal,,,Precise Interprocedural Dependence Analysis of Parallel Programs,,,,02-08,2002,Bor Luen Tang|Laurens Landeweerd,Irving L. Traiger|Somsri Wiwanitkit|Sara Goering,Cloud computing|Machine learning|Data mining|Algorithm analysis,Information theory|Artificial intelligence,accept,Velit sed sed consectetur.,accept,Dolore quiquia numquam sed ut.,Full Paper
548,550,Gerhard J. Woeginger|Klaus Jansen|Petra Scheffler,,,,,,,,,,,,,,"Universität Trier, Mathematik/Informatik, Forschungsbericht",tr/trier/MI92-23,2017-06-08,,,,,,,,,informal,,,The Disjoint Cliques Problem,,,,92-23,1992,Iman A. Basheti|Charles E. Harris,Irving L. Traiger|Somsri Wiwanitkit|Sara Goering,Cloud computing|Machine learning|Data mining|Algorithm analysis,Machine learning,accept,Sit dolor modi velit est.,accept,Velit numquam quisquam quisquam ut eius sit.,Full Paper
549,551,Jens Hofmann 0001,,,,,,,,,,,,,,"Universität Trier, Mathematik/Informatik, Forschungsbericht",tr/trier/MI98-18,2019-04-12,,,,,,,,,informal,,,Stability Conditions for the BMAP/G/1 Queue with Level Dependent Arrivals,,,,98-18,1998,Susan Dodds|Florian Jarre,Irving L. Traiger|Somsri Wiwanitkit|Sara Goering,Cloud computing|Machine learning|Data mining|Algorithm analysis,Robotics,accept,Etincidunt sed aliquam tempora voluptatem sed.,accept,Quiquia quaerat dolor voluptatem.,Full Paper
550,552,Klaus Jansen,,,,,,,,,,,,,,"Universität Trier, Mathematik/Informatik, Forschungsbericht",tr/trier/MI92-15,2017-06-08,,,,,,,,,informal,,,On the Complexity of a Licence Constrained Job Assignment Problem,,,,92-15,1992,Cristina del Barrio|Maarten Botterman,Irving L. Traiger|Somsri Wiwanitkit|Sara Goering,Cloud computing|Machine learning|Data mining|Algorithm analysis,Information theory|Computer networks|Algorithm analysis,accept,Adipisci dolorem consectetur amet etincidunt.,reject,Etincidunt magnam eius porro est magnam labore.,Full Paper
551,553,Anderson Rocha 0001|Jacques Wainer|Michael Eckmann|Siome Goldenstein,,,,,,,,,,,http://www.ic.unicamp.br/~reltech/2012/12-08.pdf,oa,,Technical Report,tr/unicamp/IC-12-08,2020-03-24,,"In English, 30 pages",,,,,"Institute of Computing, University of Campinas, Campinas, Brazil",,informal,,,Differences in productivity and impact across the different computer science subareas.,,,,IC-12-08,2012,Marc Lampe|Michael Lemaster,Erick Chastain|Anjali Truitt|Gabriele Lombardi|Mohammadamin Erfanmanesh,Cryptography|Computer vision|Distributed computing|Algorithm analysis|Cybersecurity,Cryptography,accept,Ipsum est quisquam tempora eius sit quaerat modi.,reject,Sit numquam dolor aliquam sit quiquia est.,Full Paper
552,554,,,,,,,,,,Paul R. McJones,,http://www.mcjones.org/System_R/SQL_Reunion_95/,,,Digital System Research Center Report,tr/dec/SRC1997-018,2017-06-08,,,,,,,,,informal,,,"The 1995 SQL Reunion: People, Project, and Politics, May 29, 1995.",,,,SRC1997-018,1997,Daming Zhang|Ulrich Raber,Delia Murphy|Helen Morley|Yue Guan,Computational complexity|Cryptography|Algorithm analysis|Computer graphics,High-performance computing|Machine learning|Computer vision,accept,Etincidunt sed modi tempora aliquam modi porro.,reject,Sit est ipsum numquam.,Full Paper
553,570,E. F. Codd,,,,,,,,,,,,,,"Research Report / RJ / IBM / San Jose, California",persons/Codd71b,2020-02-21,November,,,,,,,,informal,,,Normalized Data Base Structure: A Brief Tutorial.,,,,RJ935,1971,Shane Epting|Mike Kelley,Masamichi Shimosaka|Péter Csizsek|Xun Lu|Romain Thibaux,Robotics|Computer vision|Quantum computing|Human-computer interaction|Artificial intelligence,Computer networks|Quantum computing,reject,Magnam sit porro labore tempora.,reject,Velit amet labore porro sit sit magnam.,Full Paper
554,573,E. F. Codd,,,,,ibmTR/rj987.pdf,,,,,,,,,"Research Report / RJ / IBM / San Jose, California",persons/Codd72,2020-02-21,March,"republished on ""ACM SIGMOD Anthology""",,,,,,,informal,,,Relational Completeness of Data Base Sublanguages.,,,,RJ987,1972,Antje Schnarr|Luciano Floridi,Masamichi Shimosaka|Péter Csizsek|Xun Lu|Romain Thibaux,Robotics|Computer vision|Quantum computing|Human-computer interaction|Artificial intelligence,Human-computer interaction|Artificial intelligence|Quantum computing,accept,Dolor magnam voluptatem quaerat.,accept,Porro modi porro dolore quisquam.,Full Paper
555,574,Michael Ley,,,,,,,,,,,,,,Compulog Newsletter,persons/Ley95,2018-07-05,,,,,,,,,informal,,,DB&LP: A WWW Bibliography on Databases and Logic Programming,,,,,1995,Markus Müller-Olm|Michael McNamee,Gui-Bo Ye|Suchi Saria|Christopher Hart,Distributed computing|Quantum computing|Robotics|Computer graphics|Artificial intelligence,Artificial intelligence,reject,Dolorem adipisci dolore ipsum velit sit.,reject,Quisquam magnam velit non sit labore.,Short Paper
556,575,C. J. Date 0001|E. F. Codd,,,,,,,,,,,,,,"Research Report / RJ / IBM / San Jose, California",persons/CoddD74,2021-05-15,June,,,,,,,,informal,,,Interactive Support for Non-Programmers: The Relational and Network Approaches.,,,,RJ1400,1974,Ulrich Hertrampf|Reiner Horst,Masamichi Shimosaka|Péter Csizsek|Xun Lu|Romain Thibaux,Robotics|Computer vision|Quantum computing|Human-computer interaction|Artificial intelligence,High-performance computing,accept,Voluptatem ut porro quisquam numquam quiquia.,accept,Amet tempora velit est quiquia neque.,Full Paper
557,576,E. F. Codd,,,,,,,,,,,,,,"Research Report / RJ / IBM / San Jose, California",persons/Codd71,2020-02-21,July,,,,,,,,informal,,,Data Base Sublanguage Founded on the Relational Calculus.,,,,RJ893,1971,Angel Peiró-Signes|Mohd Salim Mohamed,Masamichi Shimosaka|Péter Csizsek|Xun Lu|Romain Thibaux,Robotics|Computer vision|Quantum computing|Human-computer interaction|Artificial intelligence,Big data,accept,Adipisci sed sit modi adipisci ipsum eius.,reject,Quaerat dolor neque consectetur quiquia consectetur.,Demo Paper
558,577,Hugo Hellebrand|Markus Casper|Ralf Merz|Rita Ley,,0000-0002-1163-8988,,,,,,,,,https://doi.org/10.5194/hess-15-2947-2011,oa,,Hydrology and Earth System Sciences,persons/LeyCHM11,2020-02-04,,,,,,2947-2962,,,,,,Catchment classification by runoff behaviour with self-organizing maps (SOM),,,,15,2011,Vanessa Chenel|Jesse Engebretson,Michael Schwarz 0001|Martin Schafföner|Anna Marousková|Kari A. Baldwin,Computational complexity|Machine learning|Information theory,Cryptography,reject,Ipsum non quisquam ipsum consectetur.,accept,Labore sit voluptatem amet magnam.,Full Paper
559,579,Patrick A. V. Hall,,,,,,,,,,,,,,"Technical Rep. UKSC 0060, IBM United Kingdom Scientific Centre",persons/Hall74,2002-01-03,November,,,,,,,,,,,Common Subexpression Identification in General Algebraic Systems.,,,,,1974,Michael G. Anderson|John Westwater,Tarek Abudawood|Vladimir Martyanov|Jürgen Huschens|Frank Konietschke|Yuan (Alan) Qi,Robotics|Deep learning|Big data,Computer networks|High-performance computing|Cryptography,accept,Tempora dolore quiquia amet.,accept,Numquam sed modi etincidunt tempora dolore ipsum.,Demo Paper
560,580,E. F. Codd,,,,,,,,,,,,,,"Research Report / RJ / IBM / San Jose, California",persons/Codd71a,2020-02-21,August,,,,,,,,informal,,,Further Normalization of the Data Base Relational Model.,,,,RJ909,1971,Marco Tacca|Roel Snieder,Masamichi Shimosaka|Péter Csizsek|Xun Lu|Romain Thibaux,Robotics|Computer vision|Quantum computing|Human-computer interaction|Artificial intelligence,Deep learning|Quantum computing,accept,Dolorem quaerat quisquam tempora ut quiquia neque quaerat.,accept,Ipsum velit amet dolor sed.,Demo Paper
561,581,E. F. Codd,,,,,ibmTR/rj599.pdf,,,,,,,,,"Research Report / RJ / IBM / San Jose, California",persons/Codd69,2020-02-21,August,,,,,,,,informal,,,"Derivability, Redundancy and Consistency of Relations Stored in Large Data Banks.",,,,RJ599,1969,Katherine A. Austin|Clemens Lautemann,Masamichi Shimosaka|Péter Csizsek|Xun Lu|Romain Thibaux,Robotics|Computer vision|Quantum computing|Human-computer interaction|Artificial intelligence,Data mining|Computational complexity,reject,Adipisci etincidunt labore sed dolor tempora magnam.,reject,Quiquia labore tempora dolorem amet.,Demo Paper
562,583,Markus Tresch,,,,,,,,,,,https://doi.org/10.3929/ethz-a-006651652,,,"ETH Zurich, Department of Computer Science / Technical Report",persons/Tresch96,2020-02-21,July,,,,,1-27,,,informal,,,Principles of Distributed Object Database Languages.,,,,248,1996,A. Lauren Crain|Noam Paz,Arthur U. Asuncion|Hardy Kremer|Vaman Kulkarni|Henri Maître,Robotics|Distributed computing|Artificial intelligence|Machine learning|Cybersecurity,Robotics,reject,Neque etincidunt adipisci numquam.,reject,Neque non velit sed.,Full Paper
563,584,E. F. Codd,,,,,ibmTR/rj3132.pdf,,,,,,,,,"Research Report / RJ / IBM / San Jose, California",persons/Codd81,2020-02-21,May,,,,,,,,informal,,,The Capabilities of Relational Database Management Systems.,,,,RJ3132,1981,Md Zahidul Islam 0001|David M. Shaw,Masamichi Shimosaka|Péter Csizsek|Xun Lu|Romain Thibaux,Robotics|Computer vision|Quantum computing|Human-computer interaction|Artificial intelligence,Artificial intelligence|Natural language processing,reject,Sit quisquam quaerat velit modi.,reject,Voluptatem dolorem numquam labore non.,Short Paper
564,585,Andreas Rock|Gayane Grigoryan|Günther Heinemann|Markus Casper|Oliver Gronz|Oliver Gutjahr|Rita Ley,,0000-0002-1163-8988|0000-0002-4831-9016,,,,,,,,,https://doi.org/10.5194/hess-16-409-2012,oa,,Hydrology and Earth System Sciences,persons/CasperGGGHLR12,2020-02-04,,,,,,409-421,,,,,,Analysis of projected hydrological behavior of catchments based on signature indices,,,,16,2012,Jelena Omazic|Viroj Wiwanitkit,Michael Schwarz 0001|Martin Schafföner|Anna Marousková|Kari A. Baldwin,Computational complexity|Machine learning|Information theory,Natural language processing,reject,Eius quisquam dolor dolore.,reject,Neque quiquia non aliquam velit velit eius.,Short Paper
565,28670,Sarah R. Davies,,0000-0002-2113-9103,,,,,,,,,https://doi.org/10.1007/s11948-018-0064-y|https://www.wikidata.org/entity/Q58657000,,,Sci. Eng. Ethics,journals/see/Davies19,2020-07-09,,,,,4.0,1235-1253,,,,,,An Ethics of the System: Talking to Scientists About Research Integrity.,,,db/journals/see/see25.html#Davies19,25,2019,Matthew J. Drake|Boris Kotchoubey,Chi-Jen Lu|Marzieh Morovati|Róbert Busa-Fekete|Nicolas Boulanger-Lewandowski,Algorithm analysis|Big data|Distributed computing,Quantum computing,reject,Magnam tempora dolorem labore dolorem.,reject,Magnam magnam voluptatem porro voluptatem dolore modi modi.,Short Paper
566,28671,Colleen Murphy|Paolo Gardoni,,,,,,,,,,,https://doi.org/10.1007/s11948-007-9031-8|https://www.wikidata.org/entity/Q81305817,,,Sci. Eng. Ethics,journals/see/MurphyG08,2020-07-09,,,,,1.0,77-92,,,,,,The Acceptability and the Tolerability of Societal Risks: A Capabilities-based Approach.,,,db/journals/see/see14.html#MurphyG08,14,2008,Jose A. García 0001|Peter Kroes,Chi-Jen Lu|Marzieh Morovati|Róbert Busa-Fekete|Nicolas Boulanger-Lewandowski,Algorithm analysis|Big data|Distributed computing,Computer networks,reject,Dolor porro etincidunt est modi adipisci ipsum consectetur.,reject,Dolore voluptatem velit magnam ut labore ut neque.,Demo Paper
567,28672,Louise A. Dennis,,0000-0003-1426-1896,,,,,,,,,https://doi.org/10.1007/s11948-020-00244-y|https://www.wikidata.org/entity/Q98199263,oa,,Sci. Eng. Ethics,journals/see/Dennis20,2021-05-14,,,,,5.0,2487-2495,,,,,,"Computational Goals, Values and Decision-Making.",,,db/journals/see/see26.html#Dennis20,26,2020,Jathan Sadowski|Nicole M. Smith,Chi-Jen Lu|Marzieh Morovati|Róbert Busa-Fekete|Nicolas Boulanger-Lewandowski,Algorithm analysis|Big data|Distributed computing,Artificial intelligence|Cybersecurity|Quantum computing,reject,Sit ut amet quaerat dolorem labore velit.,reject,Etincidunt sit eius quaerat quiquia sed.,Short Paper
568,28673,Steven R. Smith,,0000-0002-5098-8147,,,,,,,,,https://doi.org/10.1007/s11948-012-9390-7|https://www.wikidata.org/entity/Q44045116,,,Sci. Eng. Ethics,journals/see/Smith12,2022-10-02,,,,,3.0,475-481,,,,,,"Neuroscience, Ethics and Legal Responsibility: The Problem of the Insanity Defense - Commentary on ""The Ethics of Neuroscience and the Neuroscience of Ethics: A Phenomenological-Existential Approach"".",,,db/journals/see/see18.html#Smith12,18,2012,Cesare A. Galtieri|Brent D. Mittelstadt 0002,Chi-Jen Lu|Marzieh Morovati|Róbert Busa-Fekete|Nicolas Boulanger-Lewandowski,Algorithm analysis|Big data|Distributed computing,Cybersecurity,reject,Eius adipisci dolore quisquam porro quiquia.,accept,Dolore magnam neque sit voluptatem non.,Full Paper
569,28674,Lishan Lan|Qin Zhu|Yongmou Liu,,0000-0002-6673-1901,,,,,,,,,https://doi.org/10.1007/s11948-021-00341-6,,,Sci. Eng. Ethics,journals/see/LanZL21,2021-11-03,,,,,5.0,64,,,,,,The Rule of Virtue: A Confucian Response to the Ethical Challenges of Technocracy.,,,db/journals/see/see27.html#LanZL21,27,2021,William D. Lawson|Christine Winberg,Chi-Jen Lu|Marzieh Morovati|Róbert Busa-Fekete|Nicolas Boulanger-Lewandowski,Algorithm analysis|Big data|Distributed computing,Computer networks|Human-computer interaction|Robotics,reject,Ipsum quisquam ut neque est eius quiquia.,accept,Quisquam ut dolorem velit dolorem ut.,Demo Paper
570,28675,Indira Nair|William M. Bulleit,,,,,,,,,,,https://doi.org/10.1007/s11948-018-0080-y|https://www.wikidata.org/entity/Q90930992,,,Sci. Eng. Ethics,journals/see/NairB20,2020-07-09,,,,,1.0,65-87,,,,,,Pragmatism and Care in Engineering Ethics.,,,db/journals/see/see26.html#NairB20,26,2020,Matthew Benjamin Reisman|Sepehr Pourmonajemzadeh,Chi-Jen Lu|Marzieh Morovati|Róbert Busa-Fekete|Nicolas Boulanger-Lewandowski,Algorithm analysis|Big data|Distributed computing,Natural language processing,reject,Numquam numquam etincidunt quaerat dolorem.,reject,Dolor sit ut velit magnam.,Demo Paper
571,28676,Jaime A. Teixeira da Silva,,,,,,,,,,,https://doi.org/10.1007/s11948-016-9863-1|https://www.wikidata.org/entity/Q53750216,,,Sci. Eng. Ethics,journals/see/Silva18,2020-07-09,,,,,1.0,323-325,,,,,,"Reflection on the Fazlul Sarkar versus PubPeer (""John Doe"") Case.",,,db/journals/see/see24.html#Silva18,24,2018,Delia Murphy|Kokab Khalili Paji,Chi-Jen Lu|Marzieh Morovati|Róbert Busa-Fekete|Nicolas Boulanger-Lewandowski,Algorithm analysis|Big data|Distributed computing,Cryptography|Quantum computing|Computational complexity,reject,Numquam ut numquam voluptatem magnam velit amet modi.,accept,Quiquia velit ipsum est non quaerat.,Short Paper
572,28677,Vito L. Punzi,,0000-0002-3689-8970,,,,,,,,,https://doi.org/10.1007/s11948-017-9948-5|https://www.wikidata.org/entity/Q47776669,,,Sci. Eng. Ethics,journals/see/Punzi18,2020-07-09,,,,,4.0,1253-1277,,,,,,A Social Responsibility Guide for Engineering Students and Professionals of all Faith Traditions: An Overview.,,,db/journals/see/see24.html#Punzi18,24,2018,Michael J. Selgelid|Luciano Floridi,Chi-Jen Lu|Marzieh Morovati|Róbert Busa-Fekete|Nicolas Boulanger-Lewandowski,Algorithm analysis|Big data|Distributed computing,Computational complexity|High-performance computing|Information theory,reject,Est velit est labore.,reject,Ipsum numquam neque quiquia dolore quisquam consectetur.,Full Paper
573,28678,David Koepsell,,,,,,,,,,,https://doi.org/10.1007/s11948-009-9158-x|https://www.wikidata.org/entity/Q33706687,,,Sci. Eng. Ethics,journals/see/Koepsell10,2020-07-09,,,,,1.0,119-133,,,,,,On Genies and Bottles: Scientists' Moral Responsibility and Dangerous Technology R&D.,,,db/journals/see/see16.html#Koepsell10,16,2010,Mika Suzuki|Georges-Auguste Legault,Chi-Jen Lu|Marzieh Morovati|Róbert Busa-Fekete|Nicolas Boulanger-Lewandowski,Algorithm analysis|Big data|Distributed computing,High-performance computing|Cloud computing|Deep learning,accept,Dolore modi neque quiquia quisquam eius.,reject,Sed tempora quaerat amet numquam est velit.,Demo Paper
574,28679,William J. Frey,,,,,,,,,,,https://doi.org/10.1007/s11948-009-9164-z|https://www.wikidata.org/entity/Q49048410,,,Sci. Eng. Ethics,journals/see/Frey10,2020-07-09,,,,,3.0,611-628,,,,,,Teaching Virtue: Pedagogical Implications of Moral Psychology.,,,db/journals/see/see16.html#Frey10,16,2010,Roger Strand|Raymond E. Spier,Chi-Jen Lu|Marzieh Morovati|Róbert Busa-Fekete|Nicolas Boulanger-Lewandowski,Algorithm analysis|Big data|Distributed computing,Deep learning|Computational complexity|Robotics,reject,Sed eius sit neque sed.,reject,Magnam eius adipisci est quisquam consectetur neque.,Short Paper
575,28680,Amarjeet Singh 0004|Kewal Krishan|Neelam Dehal|Tanuj Kanchan,,0000-0001-5321-0958|0000-0003-0346-1075,,,,,,,,,https://doi.org/10.1007/s11948-017-9903-5|https://www.wikidata.org/entity/Q47225481,,,Sci. Eng. Ethics,journals/see/DehalKKS18,2020-07-09,,,,,2.0,773-777,,,,,,Mandatory Publications: An Approach to Kill 'Lack of Will' or 'Lack of Skill'?,,,db/journals/see/see24.html#DehalKKS18,24,2018,D. Kleis|Steven R. Smith,Chi-Jen Lu|Marzieh Morovati|Róbert Busa-Fekete|Nicolas Boulanger-Lewandowski,Algorithm analysis|Big data|Distributed computing,Distributed computing|Computer vision,reject,Porro ipsum amet tempora quiquia etincidunt ipsum ut.,accept,Magnam modi dolorem magnam.,Short Paper
576,28681,Adrian Treloar|Alastair J. D. Macdonald|Dimitrios Adamis|Finbarr C. Martin,,0000-0003-1315-1695,,,,,,,,,https://doi.org/10.1007/s11948-009-9120-y|https://www.wikidata.org/entity/Q51871907,,,Sci. Eng. Ethics,journals/see/AdamisTMM10,2020-07-09,,,,,1.0,169-174,,,,,,Ethical Research in Delirium: Arguments for Including Decisionally Incapacitated Subjects.,,,db/journals/see/see16.html#AdamisTMM10,16,2010,Christos Garidis|Ioanna Semendeferi,Chi-Jen Lu|Marzieh Morovati|Róbert Busa-Fekete|Nicolas Boulanger-Lewandowski,Algorithm analysis|Big data|Distributed computing,Robotics|Algorithm analysis,reject,Dolorem quisquam dolore consectetur quiquia quaerat eius.,reject,Voluptatem eius voluptatem modi sit voluptatem ut neque.,Full Paper
577,28682,Jinnie M. Garrett|Stephanie J. Bird,,,,,,,,,,,https://doi.org/10.1007/s11948-007-9016-7,oa,,Sci. Eng. Ethics,journals/see/GarrettB07,2020-07-09,,,,,4.0,581,,,,,,Ethical Issues in Communicating Science.,,,db/journals/see/see13.html#GarrettB07,13,2007,Gudrun Klose|Maja Horst,Chi-Jen Lu|Marzieh Morovati|Róbert Busa-Fekete|Nicolas Boulanger-Lewandowski,Algorithm analysis|Big data|Distributed computing,Computer vision|Information theory|Algorithm analysis,accept,Dolorem ut dolorem etincidunt eius quisquam eius tempora.,reject,Labore numquam neque numquam.,Demo Paper
578,28683,Brian Bowe|Diana Adela Martin|Eddie Conlon,,0000-0002-9368-4100,,,,,,,,,https://doi.org/10.1007/s11948-021-00333-6,oa,,Sci. Eng. Ethics,journals/see/MartinCB21,2023-02-28,,,,,5.0,60,,,,,,A Multi-level Review of Engineering Ethics Education: Towards a Socio-technical Orientation of Engineering Education for Ethics.,,,db/journals/see/see27.html#MartinCB21,27,2021,Saadia Mahmud|David B. Allison,Chi-Jen Lu|Marzieh Morovati|Róbert Busa-Fekete|Nicolas Boulanger-Lewandowski,Algorithm analysis|Big data|Distributed computing,Cybersecurity,accept,Sit velit magnam velit consectetur quaerat amet dolore.,accept,Amet sit quisquam neque.,Full Paper
579,28684,Petr Houdek,,0000-0001-9755-6635,,,,,,,,,https://doi.org/10.1007/s11948-019-00117-z|https://www.wikidata.org/entity/Q92736437,,,Sci. Eng. Ethics,journals/see/Houdek20,2020-07-09,,,,,2.0,691-707,,,,,,Fraud and Understanding the Moral Mind: Need for Implementation of Organizational Characteristics into Behavioral Ethics.,,,db/journals/see/see26.html#Houdek20,26,2020,Ulrich Hertrampf|Susan G. Spierre,Chi-Jen Lu|Marzieh Morovati|Róbert Busa-Fekete|Nicolas Boulanger-Lewandowski,Algorithm analysis|Big data|Distributed computing,Deep learning|Computer vision,accept,Labore sit sit dolore voluptatem dolor.,reject,Voluptatem ipsum est neque dolore velit adipisci.,Short Paper
580,28685,Enrica Marchigiani|Ileana Di Pomponio|Margherita Bracci|Oronzo Parlangeli|Paola Palmitesta|Stefano Guidi,,0000-0002-2040-3507,,,,,,,,,https://doi.org/10.1007/s11948-022-00362-9,oa,,Sci. Eng. Ethics,journals/see/ParlangeliPBMPG22,2022-05-13,,,,,1.0,9,,,,,,"University Teachers During the First Lockdown Due to SARS-CoV-2 in Italy: Stress, Issues and Perceptions of Misconduct.",,,db/journals/see/see28.html#ParlangeliPBMPG22,28,2022,Roland Tormey|Noureddine Bettahar,Chi-Jen Lu|Marzieh Morovati|Róbert Busa-Fekete|Nicolas Boulanger-Lewandowski,Algorithm analysis|Big data|Distributed computing,Cloud computing,reject,Est velit consectetur dolore porro velit quiquia.,accept,Dolor adipisci sed consectetur dolorem.,Short Paper
581,28686,Laura Yenisa Cabrera Trujillo|Sabrina Engel-Glatter,,,,,,,,,,,https://doi.org/10.1007/s11948-014-9556-6|https://www.wikidata.org/entity/Q38217150,,,Sci. Eng. Ethics,journals/see/TrujilloE15,2020-07-09,,,,,3.0,595-617,,,,,,Human-Animal Chimera: A Neuro Driven Discussion? Comparison of Three Leading European Research Countries.,,,db/journals/see/see21.html#TrujilloE15,21,2015,Sebastian M. Pfotenhauer|Jan Wilms,Chi-Jen Lu|Marzieh Morovati|Róbert Busa-Fekete|Nicolas Boulanger-Lewandowski,Algorithm analysis|Big data|Distributed computing,Distributed computing,accept,Ut voluptatem numquam dolore velit velit sit.,accept,Ut ipsum porro sed ut quaerat sit consectetur.,Full Paper
582,28687,Peter M. Attia,,0000-0003-4745-5726,,,,,,,,,https://doi.org/10.1007/s11948-012-9422-3|https://www.wikidata.org/entity/Q48339685,,,Sci. Eng. Ethics,journals/see/Attia13,2020-07-29,,,,,3.0,1007-1016,,,,,,Mega-Sized Concerns from the Nano-Sized World: The Intersection of Nano- and Environmental Ethics.,,,db/journals/see/see19.html#Attia13,19,2013,Oliver Möller|Vera Watson,Chi-Jen Lu|Marzieh Morovati|Róbert Busa-Fekete|Nicolas Boulanger-Lewandowski,Algorithm analysis|Big data|Distributed computing,Computer graphics|Algorithm analysis,accept,Neque magnam modi sed.,reject,Voluptatem aliquam etincidunt numquam numquam tempora.,Demo Paper
583,28688,Albert P. C. Chan|Amos Darko|Igor Martek|M. Reza Hosseini|Mahdi Tahmasebi|Saeed Banihashemi,,0000-0001-8675-736X|0000-0002-7438-1235|0000-0002-7978-6039,,,,,,,,,https://doi.org/10.1007/s11948-019-00089-0|https://www.wikidata.org/entity/Q91374986,,,Sci. Eng. Ethics,journals/see/HosseiniMBCDT20,2020-10-26,,,,,1.0,205-231,,,,,,Distinguishing Characteristics of Corruption Risks in Iranian Construction Projects: A Weighted Correlation Network Analysis.,,,db/journals/see/see26.html#HosseiniMBCDT20,26,2020,Andrzej Górski|Bernd Sturmfels,Chi-Jen Lu|Marzieh Morovati|Róbert Busa-Fekete|Nicolas Boulanger-Lewandowski,Algorithm analysis|Big data|Distributed computing,Computer networks|Cybersecurity|Computer vision,accept,Quiquia dolore sed ipsum dolor sit labore sed.,reject,Velit ipsum voluptatem aliquam voluptatem dolore.,Demo Paper
584,28689,Matthew Grellette,,0000-0002-8273-9647,,,,,,,,,https://doi.org/10.1007/s11948-022-00379-0,oa,,Sci. Eng. Ethics,journals/see/Grellette22,2022-07-27,,,,,3.0,28,,,,,,Tech Ethics Through Trust Auditing.,,,db/journals/see/see28.html#Grellette22,28,2022,Gary H. Glover|Owen Guy,Chi-Jen Lu|Marzieh Morovati|Róbert Busa-Fekete|Nicolas Boulanger-Lewandowski,Algorithm analysis|Big data|Distributed computing,Computer networks|Computer graphics|Robotics,reject,Quaerat voluptatem voluptatem numquam.,reject,Modi numquam non quiquia voluptatem.,Full Paper
